[
  {
    "name": "Foo",
    "token_path": "gno.land/r/demo/foo20.FOO",
    "pkg_path": "gno.land/r/demo/foo20",
    "symbol": "FOO",
    "decimals": 4,
    "chain_id": "test7",
    "description": "Lorem ipsum dolor sit amet, consectetur adipiscing elit. Nullam nec purus nec nunc tincidunt ultricies. Nullam nec purus nec nunc tincidunt ultricies.",
    "website_url": "https://gno.land/r/demo/foo20",
    "twitter_url": "",
    "discord_url": "",
    "docs_url": "",
    "image": ""
  },
  {
    "name": "wrapped GNOT",
    "token_path": "gno.land/r/demo/wugnot.wugnot",
    "pkg_path": "gno.land/r/demo/wugnot",
    "symbol": "wugnot",
    "decimals": 0,
    "chain_id": "test7",
    "description": "Lorem ipsum dolor sit amet, consectetur adipiscing elit. Nullam nec purus nec nunc tincidunt ultricies. Nullam nec purus nec nunc tincidunt ultricies.",
    "website_url": "https://gno.land/r/demo/wugnot",
    "twitter_url": "",
    "discord_url": "",
    "docs_url": "",
    "image": "/grc20/images/gno_land_r_demo_wugnot.svg"
  },
  {
    "name": "Foo",
    "token_path": "gno.land/r/gnoswap/v1/test_token/foo.FOO",
    "pkg_path": "gno.land/r/gnoswap/v1/test_token/foo",
    "symbol": "FOO",
    "decimals": 6,
    "chain_id": "test7",
    "description": "Foo is a GRC20 token issued solely with testing purpose. Lorem ipsum dolor sit amet, consectetur adipiscing elit. Phasellus nisi orci, ultrices sit amet mi eget, efficitur elementum tellus. Integer augue purus, rutrum eu pretium sit amet, varius in quam. In auctor gravida pretium. Maecenas est ante, pulvinar id accumsan eget, aliquam ac turpis. Donec vulputate nunc tellus. In sit amet mattis nisl. Mauris libero quam, hendrerit dapibus scelerisque eu, fringilla sit amet sapien. Proin ut semper risus. Vivamus fringilla eget lectus ut faucibus. Proin vitae mollis massa. Sed bibendum tortor eget aliquam commodo. Etiam et eleifend augue. Donec molestie placerat elit. Lorem ipsum dolor sit amet, consectetur adipiscing elit. Phasellus nisi orci, ultrices sit amet mi eget, efficitur elementum tellus. Integer augue purus, rutrum eu pretium sit amet, varius in quam. In auctor gravida pretium. Maecenas est ante, pulvinar id accumsan eget, aliquam ac turpis. Donec vulputate nunc tellus. In sit amet mattis nisl. Mauris libero quam, hendrerit dapibus scelerisque. Lorem ipsum dolor sit amet, consectetur adipiscing elit. Phasellus nisi orci, ultrices sit amet mi eget, efficitur elementum tellus. Integer augue purus, rutrum eu pretium sit amet, varius in quam. In auctor gravida pretium. Maecenas est ante, pulvinar id accumsan eget, aliquam ac turpis. Donec vulputate nunc tellus. In sit amet mattis nisl. Mauris libero quam, hendrerit dapibus scelerisque eu, fringilla sit amet sapien.",
    "website_url": "https://beta.gnoswap.io",
    "twitter_url": "https://x.com/gnoscan",
    "discord_url": "https://discord.com/invite/u4bdGHStb2",
    "docs_url": "https://docs.gnoswap.io/user-guide/getting-started/quick-tour",
    "image": "/grc20/images/gno_land_r_onbloc_foo.svg"
  },
  {
    "name": "Bar",
    "token_path": "gno.land/r/gnoswap/v1/test_token/bar.BAR",
    "pkg_path": "gno.land/r/gnoswap/v1/test_token/bar",
    "symbol": "BAR",
    "decimals": 6,
    "chain_id": "test7",
    "description": "Lorem ipsum dolor sit amet, consectetur adipiscing elit. Phasellus nisi orci, ultrices sit amet mi eget, efficitur elementum tellus. Integer augue purus, rutrum eu pretium sit amet, varius in quam. In auctor gravida pretium. Maecenas est ante, pulvinar id accumsan eget, aliquam ac turpis. Donec vulputate nunc tellus. In sit amet mattis nisl. Mauris libero quam, hendrerit dapibus scelerisque eu, fringilla sit amet sapien. Proin ut semper risus. Vivamus fringilla eget lectus ut faucibus. Proin vitae mollis massa. Sed bibendum tortor eget aliquam commodo. Etiam et eleifend augue. Donec molestie placerat elit. Lorem ipsum dolor sit amet, consectetur adipiscing elit. Phasellus nisi orci, ultrices sit amet mi eget, efficitur elementum tellus. Integer augue purus, rutrum eu pretium sit amet, varius in quam. In auctor gravida pretium. Maecenas est ante, pulvinar id accumsan eget, aliquam ac turpis. Donec vulputate nunc tellus. In sit amet mattis nisl. Mauris libero quam, hendrerit dapibus scelerisque.",
    "website_url": "https://beta.gnoswap.io",
    "twitter_url": "https://x.com/gnoswaplabs",
    "discord_url": "https://discord.com/invite/u4bdGHStb2",
    "docs_url": "https://docs.gnoswap.io/user-guide/getting-started",
    "image": "/grc20/images/gno_land_r_onbloc_bar.svg"
  },
  {
    "name": "Baz",
    "token_path": "gno.land/r/gnoswap/v1/test_token/baz.BAZ",
    "pkg_path": "gno.land/r/gnoswap/v1/test_token/baz",
    "symbol": "BAZ",
    "decimals": 6,
    "chain_id": "test7",
    "description": "Adena is a friendly, open-source, non-custodial gno.land wallet, built for Gnomes worldwide. Adena exists to power millions of realms and tokens that will flourish the gno.land ecosystem with a quality interface, NFT & custom token support, and a seamless integration procedure.",
    "website_url": "https://beta.gnoswap.io",
    "twitter_url": "https://x.com/adenaapp",
    "discord_url": "https://discord.com/invite/u4bdGHStb2",
    "docs_url": "https://docs.gnoswap.io/user-guide/getting-started",
    "image": "/grc20/images/gno_land_r_onbloc_baz.svg"
  },
  {
    "name": "Qux",
    "token_path": "gno.land/r/gnoswap/v1/test_token/qux.QUX",
    "pkg_path": "gno.land/r/gnoswap/v1/test_token/qux",
    "symbol": "QUX",
    "decimals": 6,
    "chain_id": "test7",
    "description": "Lorem ipsum dolor sit amet, consectetur adipiscing elit. Phasellus nisi orci, ultrices sit amet mi eget, efficitur elementum tellus. Integer augue purus, rutrum eu pretium sit amet, varius in quam. In auctor gravida pretium. Lorem ipsum dolor sit amet, consectetur adipiscing elit. Phasellus nisi orci, ultrices sit amet mi eget, efficitur elementum tellus. Integer augue purus, rutrum eu pretium sit amet, varius in quam. In auctor gravida pretium.",
    "website_url": "https://beta.gnoswap.io",
    "twitter_url": "https://x.com/onblocxyz/media",
    "discord_url": "https://discord.com/invite/u4bdGHStb2",
    "docs_url": "https://docs.gnoswap.io/user-guide/trading",
    "image": "/grc20/images/gno_land_r_onbloc_qux.svg"
  },
  {
    "name": "Gnoswap",
    "token_path": "gno.land/r/gnoswap/gns.GNS",
    "pkg_path": "gno.land/r/gnoswap/gns",
    "symbol": "GNS",
    "decimals": 6,
    "chain_id": "test7",
    "description": "GNS is a GRC20 token issued solely for testing purposes.",
    "website_url": "https://beta.gnoswap.io",
    "twitter_url": "https://x.com/gnoswaplabs",
    "discord_url": "https://discord.com/invite/u4bdGHStb2",
    "docs_url": "https://docs.gnoswap.io",
    "image": "/grc20/images/gno_land_r_gnoswap_gns.svg"
  },
  {
    "name": "Onbloc",
    "token_path": "gno.land/r/gnoswap/v1/test_token/obl.OBL",
    "pkg_path": "gno.land/r/gnoswap/v1/test_token/obl",
    "symbol": "OBL",
    "decimals": 6,
    "chain_id": "test7",
    "description": "Onbloc is a leading gno.land blockchain software company building Adena and Gnoscan to make it easy to build applications on gno.land. gno.land is a public blockchain initiative led by Jae Kwon, the creator of Cosmos Network and Tendermint. As an active contributor to the gno.land ecosystem, Onbloc is committed to developing gno.land-native dapps, operating a gno.land validator, and investing in aspiring projects building on gno.land.",
    "website_url": "https://beta.gnoswap.io",
    "twitter_url": "https://x.com/gnoswaplabs",
    "discord_url": "https://discord.com/invite/u4bdGHStb2",
    "docs_url": "https://docs.gnoswap.io/user-guide/getting-started",
    "image": "/grc20/images/gno_land_r_onbloc_obl.svg"
  },
  {
    "name": "Usd Coin",
    "token_path": "gno.land/r/gnoswap/v1/test_token/usdc.USDC",
    "pkg_path": "gno.land/r/gnoswap/v1/test_token/usdc",
    "symbol": "USDC",
    "decimals": 6,
    "chain_id": "test7",
    "description": "USDC is a GRC20 stablecoin issued solely for testing purposes.",
    "website_url": "https://beta.gnoswap.io",
    "twitter_url": "https://x.com/gnoswaplabs",
    "discord_url": "https://discord.com/invite/u4bdGHStb2",
    "docs_url": "https://docs.gnoswap.io/user-guide/getting-started",
    "image": "/grc20/images/gno_land_r_onbloc_usdc.svg"
  }
]
