[
  {
    "name": "Foo",
    "token_path": "gno.land/r/demo/defi/foo20.FOO",
    "pkg_path": "gno.land/r/demo/defi/foo20",
    "symbol": "FOO",
    "decimals": 4,
    "chain_id": "topaz-1",
    "description": "This is a GRC20 token issued on topaz-1 for testing purposes only. This token has no actual value and never will. There is no guarantee that this token will be available on mainnet.",
    "website_url": "https://gno.land/r/demo/defi/foo20",
    "twitter_url": "",
    "discord_url": "",
    "docs_url": "",
    "image": ""
  },
  {
    "name": "wrapped GNOT",
    "token_path": "gno.land/r/gnoland/wugnot.wugnot",
    "pkg_path": "gno.land/r/gnoland/wugnot",
    "symbol": "wugnot",
    "decimals": 0,
    "chain_id": "topaz-1",
    "description": "This is a GRC20 token issued on topaz-1 for testing purposes only. This token has no actual value and never will. There is no guarantee that this token will be available on mainnet.",
    "website_url": "https://gno.land/r/gnoland/wugnot",
    "twitter_url": "",
    "discord_url": "",
    "docs_url": "",
    "image": "/grc20/images/gno_land_r_demo_wugnot.svg"
  },
  {
    "name": "Bitcoin",
    "token_path": "gno.land/r/gnoswap/test_token/test_btc.BTC",
    "pkg_path": "gno.land/r/gnoswap/test_token/test_btc",
    "symbol": "BTC",
    "decimals": 8,
    "chain_id": "topaz-1",
    "description": "This is a GRC20 token issued on topaz-1 for testing purposes only. This token has no actual value and never will. There is no guarantee that this token will be available on mainnet.",
    "website_url": "https://beta.gnoswap.io",
    "twitter_url": "https://x.com/gnoswaplabs",
    "discord_url": "https://discord.com/invite/u4bdGHStb2",
    "docs_url": "https://docs.gnoswap.io/user-guide/getting-started",
    "image": "/grc20/images/test_btc.svg"
  },
  {
    "name": "AtomOne",
    "token_path": "gno.land/r/gnoswap/test_token/test_atone.ATONE",
    "pkg_path": "gno.land/r/gnoswap/test_token/test_atone",
    "symbol": "ATONE",
    "decimals": 6,
    "chain_id": "topaz-1",
    "description": "This is a GRC20 token issued on topaz-1 for testing purposes only. This token has no actual value and never will. There is no guarantee that this token will be available on mainnet.",
    "website_url": "https://beta.gnoswap.io",
    "twitter_url": "https://x.com/gnoswaplabs",
    "discord_url": "https://discord.com/invite/u4bdGHStb2",
    "docs_url": "https://docs.gnoswap.io/user-guide/getting-started",
    "image": "/grc20/images/test_atone.svg"
  },
  {
    "name": "Photon",
    "token_path": "gno.land/r/gnoswap/test_token/test_photon.PHOTON",
    "pkg_path": "gno.land/r/gnoswap/test_token/test_photon",
    "symbol": "PHOTON",
    "decimals": 6,
    "chain_id": "topaz-1",
    "description": "This is a GRC20 token issued on topaz-1 for testing purposes only. This token has no actual value and never will. There is no guarantee that this token will be available on mainnet.",
    "website_url": "https://beta.gnoswap.io",
    "twitter_url": "https://x.com/gnoswaplabs",
    "discord_url": "https://discord.com/invite/u4bdGHStb2",
    "docs_url": "https://docs.gnoswap.io/user-guide/trading",
    "image": "/grc20/images/test_photon.svg"
  },
  {
    "name": "GnoSwap",
    "token_path": "gno.land/r/gnoswap/gns.GNS",
    "pkg_path": "gno.land/r/gnoswap/gns",
    "symbol": "GNS",
    "decimals": 6,
    "chain_id": "topaz-1",
    "description": "This is a GRC20 token issued on topaz-1 for testing purposes only. This token has no actual value and never will. There is no guarantee that this token will be available on mainnet.",
    "website_url": "https://beta.gnoswap.io",
    "twitter_url": "https://x.com/gnoswaplabs",
    "discord_url": "https://discord.com/invite/u4bdGHStb2",
    "docs_url": "https://docs.gnoswap.io",
    "image": "/grc20/images/gno_land_r_gnoswap_gns.svg"
  },
  {
    "name": "Cosmos",
    "token_path": "gno.land/r/gnoswap/test_token/test_atom.ATOM",
    "pkg_path": "gno.land/r/gnoswap/test_token/test_atom",
    "symbol": "ATOM",
    "decimals": 6,
    "chain_id": "topaz-1",
    "description": "This is a GRC20 token issued on topaz-1 for testing purposes only. This token has no actual value and never will. There is no guarantee that this token will be available on mainnet.",
    "website_url": "https://beta.gnoswap.io",
    "twitter_url": "https://x.com/gnoswaplabs",
    "discord_url": "https://discord.com/invite/u4bdGHStb2",
    "docs_url": "https://docs.gnoswap.io/user-guide/getting-started",
    "image": "/grc20/images/test_atom.svg"
  },
  {
    "name": "Solana",
    "token_path": "gno.land/r/gnoswap/test_token/test_sol.SOL",
    "pkg_path": "gno.land/r/gnoswap/test_token/test_sol",
    "symbol": "SOL",
    "decimals": 9,
    "chain_id": "topaz-1",
    "description": "This is a GRC20 token issued on topaz-1 for testing purposes only. This token has no actual value and never will. There is no guarantee that this token will be available on mainnet.",
    "website_url": "https://beta.gnoswap.io",
    "twitter_url": "https://x.com/gnoswaplabs",
    "discord_url": "https://discord.com/invite/u4bdGHStb2",
    "docs_url": "https://docs.gnoswap.io/user-guide/getting-started",
    "image": "/grc20/images/test_sol.svg"
  },
  {
    "name": "Tron",
    "token_path": "gno.land/r/gnoswap/test_token/test_trx.TRX",
    "pkg_path": "gno.land/r/gnoswap/test_token/test_trx",
    "symbol": "TRX",
    "decimals": 6,
    "chain_id": "topaz-1",
    "description": "This is a GRC20 token issued on topaz-1 for testing purposes only. This token has no actual value and never will. There is no guarantee that this token will be available on mainnet.",
    "website_url": "https://beta.gnoswap.io",
    "twitter_url": "https://x.com/gnoswaplabs",
    "discord_url": "https://discord.com/invite/u4bdGHStb2",
    "docs_url": "https://docs.gnoswap.io/user-guide/getting-started",
    "image": "/grc20/images/test_trx.svg"
  },
  {
    "name": "Usd Coin",
    "token_path": "gno.land/r/gnoswap/test_token/test_usdc.USDC",
    "pkg_path": "gno.land/r/gnoswap/test_token/test_usdc",
    "symbol": "USDC",
    "decimals": 6,
    "chain_id": "topaz-1",
    "description": "This is a GRC20 token issued on topaz-1 for testing purposes only. This token has no actual value and never will. There is no guarantee that this token will be available on mainnet.",
    "website_url": "https://beta.gnoswap.io",
    "twitter_url": "https://x.com/gnoswaplabs",
    "discord_url": "https://discord.com/invite/u4bdGHStb2",
    "docs_url": "https://docs.gnoswap.io/user-guide/getting-started",
    "image": "/grc20/images/test_usdc.svg"
  },
  {
    "name": "Dai",
    "token_path": "gno.land/r/gnoswap/test_token/test_dai.DAI",
    "pkg_path": "gno.land/r/gnoswap/test_token/test_dai",
    "symbol": "DAI",
    "decimals": 6,
    "chain_id": "topaz-1",
    "description": "This is a GRC20 token issued on topaz-1 for testing purposes only. This token has no actual value and never will. There is no guarantee that this token will be available on mainnet.",
    "website_url": "https://beta.gnoswap.io",
    "twitter_url": "https://x.com/gnoswaplabs",
    "discord_url": "https://discord.com/invite/u4bdGHStb2",
    "docs_url": "https://docs.gnoswap.io/user-guide/getting-started",
    "image": "/grc20/images/test_dai.svg"
  },
  {
    "name": "Sepolia Ether",
    "token_path": "gno.land/r/onbloc/ibc/union/apps/ucs03_zkgm.SepoliaETH",
    "pkg_path": "gno.land/r/onbloc/ibc/union/apps/ucs03_zkgm",
    "symbol": "SepoliaETH",
    "decimals": 6,
    "chain_id": "topaz-1",
    "description": "",
    "website_url": "https://topaz.testnets.gno.land/r/onbloc/ibc/union/apps/ucs03_zkgm",
    "twitter_url": "",
    "discord_url": "",
    "docs_url": "",
    "image": "/grc20/images/gno_land_r_onbloc_ibc_union_apps_ucs03_zkgm_sepoliaeth.svg"
  },
  {
    "name": "Tether USD",
    "token_path": "gno.land/r/onbloc/ibc/union/apps/ucs03_zkgm.USDT",
    "pkg_path": "gno.land/r/onbloc/ibc/union/apps/ucs03_zkgm",
    "symbol": "USDT",
    "decimals": 6,
    "chain_id": "topaz-1",
    "description": "",
    "website_url": "https://topaz.testnets.gno.land/r/onbloc/ibc/union/apps/ucs03_zkgm",
    "twitter_url": "",
    "discord_url": "",
    "docs_url": "",
    "image": "/grc20/images/gno_land_r_onbloc_ibc_union_apps_ucs03_zkgm_usdt.svg"
  }
]
