[
  {
    "name": "wGNOT",
    "token_path": "gno.land/r/gnoland/wugnot.wugnot",
    "pkg_path": "gno.land/r/gnoland/wugnot",
    "symbol": "wugnot",
    "decimals": 6,
    "chain_id": "gnoland-1",
    "description": "wugnot is a wrapped GRC20 version of GNOT, the native coin of Gno.land.",
    "website_url": "https://gno.land/r/gnoland/wugnot",
    "twitter_url": "",
    "discord_url": "",
    "docs_url": "https://gno.land/r/gnoland/wugnot",
    "image": "/grc20/images/gno_land_r_demo_wugnot.svg",
    "routes": {
      "funcs": {
        "transfer": {
          "name": "Transfer",
          "args": ["$to", "$amount"]
        },
        "approve": {
          "name": "Approve",
          "args": ["$spender", "$amount"]
        },
        "transfer_from": {
          "name": "TransferFrom",
          "args": ["$from", "$to", "$amount"]
        }
      }
    }
  },
  {
    "name": "GnoSwap",
    "token_path": "gno.land/r/gnoswap/gns.GNS",
    "pkg_path": "gno.land/r/gnoswap/gns",
    "symbol": "GNS",
    "decimals": 6,
    "chain_id": "gnoland-1",
    "description": "GnoSwap is the first decentralized exchange (DEX) built using Gnolang – an interpreted variation of the widely-used Go programming language (Golang) that powers the Gnoland blockchain ecosystem. As an automated market maker (AMM) protocol, GnoSwap features an innovative concentrated liquidity mechanism. This mechanism empowers GnoSwap to offer deeper liquidity for trading pairs, resulting in lower slippage and better trading prices for traders, while also generating more fees for liquidity providers.",
    "website_url": "https://gnoswap.io",
    "twitter_url": "https://x.com/gnoswaplabs",
    "discord_url": "https://discord.com/invite/u4bdGHStb2",
    "docs_url": "https://docs.gnoswap.io",
    "image": "/grc20/images/gno_land_r_gnoswap_gns.svg",
    "routes": {
      "funcs": {
        "transfer": {
          "name": "Transfer",
          "args": ["$to", "$amount"]
        },
        "approve": {
          "name": "Approve",
          "args": ["$spender", "$amount"]
        },
        "transfer_from": {
          "name": "TransferFrom",
          "args": ["$from", "$to", "$amount"]
        }
      }
    }
  },
  {
    "name": "XGNS",
    "token_path": "gno.land/r/gnoswap/gov/xgns.xGNS",
    "pkg_path": "gno.land/r/gnoswap/gov/xgns",
    "symbol": "xGNS",
    "decimals": 6,
    "chain_id": "gnoland-1",
    "description": "xGNS is a non-transferable governance token issued 1:1 to users who stake GNS in the single-token staking pool, which serves as the voting-power escrow for GnoSwap Governance. The amount of xGNS a user holds equals the amount of GNS they have staked.",
    "website_url": "https://gnoswap.io",
    "twitter_url": "https://x.com/gnoswaplabs",
    "discord_url": "https://discord.com/invite/u4bdGHStb2",
    "docs_url": "https://gno.land/r/gnoswap/gov/xgns",
    "image": "/grc20/images/gno_land_r_gnoswap_gov_xgns.svg",
    "routes": {
      "funcs": {}
    }
  },
  {
    "name": "Gnomic",
    "token_path": "gno.land/r/nym-thegnomic001/gnomic.GNOMIC",
    "pkg_path": "gno.land/r/nym-thegnomic001/gnomic",
    "symbol": "GNOMIC",
    "decimals": 6,
    "chain_id": "gnoland-1",
    "description": "GNOMIC is a fixed-supply GRC20 token on gno.land: 21,000,000 minted once and never again. 15,000,000 of them went to the addresses that already held GNOT at the chain's genesis, claimable from a Merkle airdrop.",
    "website_url": "https://gnomic.wtf",
    "twitter_url": "https://x.com/gnomic_gnoland",
    "discord_url": "",
    "docs_url": "https://gnomic.wtf/gnomic",
    "image": "/grc20/images/gno_land_r_nym-thegnomic001_gnomic.svg",
    "routes": {
      "funcs": {
        "transfer": {
          "name": "Transfer",
          "args": ["$to", "$amount"]
        },
        "approve": {
          "name": "Approve",
          "args": ["$spender", "$amount"]
        },
        "transfer_from": {
          "name": "TransferFrom",
          "args": ["$from", "$to", "$amount"]
        }
      }
    }
  },
  {
    "name": "BUBBLE (wrapped)",
    "token_path": "gno.land/r/g1leu8d2vsplhehcfkjg50mwgdpxdkt8tztu95wr/wbubble.BUBBLE",
    "pkg_path": "gno.land/r/g1leu8d2vsplhehcfkjg50mwgdpxdkt8tztu95wr/wbubble",
    "symbol": "BUBBLE",
    "decimals": 6,
    "chain_id": "gnoland-1",
    "description": "Wrapped BUBBLE is a registered GRC20 token backed 1:1 by the original Bubble Rumble BUBBLE held in the wrapper realm. BUBBLE is the token of Bubble Rumble (bubblerumble.net), a game of bidding pools on gno.land. It is earned by inviting friends who settle in and play, and each BUBBLE is a vote on what gets built there and on the BUBBLE treasury, which takes 5% of every boop. Supply is capped at 100,000,000; 10,000,000 is the founding share and the rest is minted only as referrals count, with the reward halving each era. The realm exposes the GRC20 surface (TotalSupply, BalanceOf, Allowance, Transfer, Approve, TransferFrom) over a ledger that also keeps voting checkpoints; it is not registered in gno.land/r/nt/grc20reg, so pools use a wrapped form. A game token: nothing promises it a value.",
    "website_url": "https://bubblerumble.net",
    "twitter_url": "",
    "discord_url": "",
    "docs_url": "https://bubblerumble.net/bubble.html",
    "image": "/grc20/images/gno_land_r_g1leu8d2vsplhehcfkjg50mwgdpxdkt8tztu95wr_wbubble.svg",
    "routes": {
      "funcs": {
        "transfer": {
          "name": "Transfer",
          "args": ["$to", "$amount"]
        },
        "approve": {
          "name": "Approve",
          "args": ["$spender", "$amount"]
        },
        "transfer_from": {
          "name": "TransferFrom",
          "args": ["$from", "$to", "$amount"]
        }
      }
    }
  },
  {
    "name": "Perun",
    "token_path": "gno.land/r/demo/defi/grc20factory.PERUN",
    "pkg_path": "gno.land/r/demo/defi/grc20factory",
    "symbol": "PERUN",
    "decimals": 6,
    "chain_id": "gnoland-1",
    "description": "PERUN is a GRC20 token on Gnoland.",
    "website_url": "https://gno.land/r/g1s2g47cas6gxamxlkpxu65zu2g4aqma38tx36yv/perun",
    "twitter_url": "https://x.com/search?q=%24PERUN",
    "discord_url": "",
    "docs_url": "https://gno.land/r/g1s2g47cas6gxamxlkpxu65zu2g4aqma38tx36yv/perun",
    "image": "/grc20/images/perun.svg",
    "routes": {
      "funcs": {
        "transfer": {
          "name": "Transfer",
          "args": ["PERUN", "$to", "$amount"]
        },
        "approve": {
          "name": "Approve",
          "args": ["PERUN", "$spender", "$amount"]
        },
        "transfer_from": {
          "name": "TransferFrom",
          "args": ["PERUN", "$from", "$to", "$amount"]
        }
      }
    }
  },
  {
    "name": "Gnomi",
    "token_path": "gno.land/r/g1n4pl5uc4yt5r96m9w6fmdznx3x0jyg8l6arhmt/gnomi/padv3.GNOMI",
    "pkg_path": "gno.land/r/g1n4pl5uc4yt5r96m9w6fmdznx3x0jyg8l6arhmt/gnomi/padv3",
    "symbol": "GNOMI",
    "decimals": 0,
    "chain_id": "gnoland-1",
    "description": "GNOMI is the GRC20 token launched on gnomi.fun, the meme launchpad on gno.land.",
    "website_url": "https://gnomi.fun",
    "twitter_url": "https://x.com/gnomidotfun",
    "discord_url": "",
    "docs_url": "https://gnomi.fun/docs",
    "image": "/grc20/images/r_g1n4pl5uc4yt5r96m9w6fmdznx3x0jyg8l6arhmt_gnomi_padv3_gnomi.svg",
    "routes": {
      "funcs": {
        "transfer": {
          "name": "Transfer",
          "args": ["0000001", "$to", "$amount"]
        },
        "approve": {
          "name": "Approve",
          "args": ["0000001", "$spender", "$amount"]
        },
        "transfer_from": {
          "name": "TransferFrom",
          "args": ["0000001", "$from", "$to", "$amount"]
        }
      }
    }
  }
]
